resume_id,skills,soft_skills,experience_years,education_degree,label,output_file
337,"Django, Coding Interview Preparation, Data Wrangling, React, Kibana, Jupyter Notebooks, Prometheus, Penetration Testing, Apache Kafka",Open-Mindedness,2.4,M.Tech,0,generate_resume292.txt
338,"REST APIs, Streamlit, React, Kibana, CSS3","Listening to Feedback, Resourcefulness, Accountability, Networking",4.04,PhD,0,generate_resume293.txt
339,"HTML5, gcp, VS Code, Linux, Apache Kafka, Big Data, CSS3","Collaboration, Cultural Awareness, Work Ethic, Patience",2.94,PhD,0,generate_resume294.txt
340,"Statistical Analysis, PostgreSQL, CSS3, Deep Learning, Big Data",Communication,4.99,M.S.,0,generate_resume295.txt
341,"OpenCV, Gradio, xai, TensorFlow, databases, Agile Methodologies, Streamlit, Statistical Analysis",Multitasking,3.49,B.E.,0,generate_resume296.txt
342,"Grafana, Ethical Hacking, Solidity, Blockchain","Cultural Awareness, Resourcefulness",3.02,Master's,0,generate_resume297.txt
343,"MySQL, HTML5, Apache Kafka, Terraform, Penetration Testing","Self-Motivation, Listening to Feedback, Patience, Initiative",8.08,PhD,0,generate_resume298.txt
344,"Scikit-learn, HTML5, Deep Learning, IntelliJ IDEA, Apache Kafka, databases, Functional Programming","Self-Awareness, Time Management, Cultural Awareness, Multitasking",9.41,M.Tech,0,generate_resume299.txt
