resume_id,skills,soft_skills,experience_years,education_degree,label,output_file
0,"apache kafka, aws, docker, git, hadoop, nltk, pandas, python, sql, tensorflow",,0,,0,output\resume\amazon-data-science-resume-example.txt
1,"data visualization, data wrangling, databases, deep learning, java, keras, mathematics, python, statistical analysis",,1.167,b.s.,0,output\resume\associate-data-scientist-resume-example.txt
2,git,,0,,0,output\resume\computer-engineering-resume-example.txt
3,"linux, mysql, python",,0,,0,output\resume\computer-programming-resume-example.txt
4,,,0,,0,output\resume\computer-repair-technician-resume-example.txt
5,"c++, mongodb",communication,0,,0,output\resume\computer-science-design-resume-example.txt
6,"aws, databases, git, javascript, mathematics, python, scrum","communication, leadership, patience",0,,0,output\resume\computer-science-engineering-teacher-resume-example.txt
7,"computer vision, django, git, graphql, javascript, postgresql, python, rest apis, sql",,9.75,b.s.,0,output\resume\computer-science-internship-resume-example.txt
8,"git, machine learning, postgresql, python, tensorflow",,0,,0,output\resume\computer-science-latex-resume-example.txt
9,python,networking,1.0,b.s.,0,output\resume\computer-science-major-resume-example.txt
10,"docker, git, javascript, selenium, tensorflow",communication,1.0,m.s.,0,output\resume\computer-science-no-experience-resume-example.txt
11,"aws, data visualization, git, model deployment, postgresql, python, sql, tensorflow",,0,,0,output\resume\computer-science-research-resume-example.txt
12,"django, git, javascript, postgresql, python, react, rest apis, sql",,3.417,b.s.,0,output\resume\computer-science-resume-example.txt
13,"computer vision, git, java, sql","creativity, initiative, networking",10.0,b.s.,0,output\resume\computer-science-student-resume-example.txt
14,"aws, cybersecurity, javascript, mongodb, postgresql, python, react",,3.667,,0,output\resume\computer-science-teaching-assistant-resume-example.txt
15,"aws, cloud computing, django, git, javascript, mysql, postgresql, python, sql","confidence, critical thinking, initiative",1.833,,0,output\resume\computer-science-tutor-resume-example.txt
16,"computer vision, deep learning, machine learning, networking, pytorch",,6.25,b.s.,0,output\resume\computer-scientist-resume-example.txt
17,,,0,,0,output\resume\computer-technician-resume-example.txt
18,"apache spark, machine learning, nlp, nltk, sql",,11.833,b.s.,0,output\resume\data-science-consultant-resume-example.txt
19,"aws, hadoop, nlp, python, tensorflow",,13.833,b.s.,0,output\resume\data-science-director-resume-example.txt
20,"aws, big data, docker, git, hadoop, mysql, python, tensorflow",collaboration,0,,0,output\resume\data-science-engineer-resume-example.txt
21,"flask, git, keras, mathematics, mysql, pandas, python, sql","accountability, decision making, leadership",9.417,b.s.,0,output\resume\data-science-manager-resume-example.txt
22,,"collaboration, teamwork",0,,0,output\resume\data-science-project-resume-example.txt
23,"apache spark, aws, pandas, python, sql",,0,,0,output\resume\data-science-student-resume-example.txt
24,"aws, big data, databases, hadoop, machine learning, pandas, python, sql",organization,6.25,b.s.,0,output\resume\data-scientist-analytics-resume-example.txt
25,"keras, mysql, sqlite",,0,,0,output\resume\data-scientist-intern-resume-example.txt
26,"computer vision, databases, deep learning, keras, machine learning, model deployment, mysql, pytorch, sqlite",,0,master's,0,output\resume\data-scientist-machine-learning-resume-example.txt
27,"aws, flask, git, keras, mysql, pandas, python, sql",,6.75,b.s.,0,output\resume\data-scientist-resume-example.txt
28,"data visualization, python",,0,,0,output\resume\data-visualization-resume-example.txt
29,"cybersecurity, hadoop, machine learning, python","collaboration, communication, critical thinking",0,master's,0,output\resume\educational-data-scientist-resume-example.txt
30,"aws, java, javascript, mysql, postgresql, react, rest apis",integrity,0.333,,0,output\resume\entry-level-android-developer-resume-example.txt
31,"django, git, graphql, javascript, postgresql, python, rest apis, selenium, sql, unit testing",,0.833,m.s.,0,output\resume\entry-level-computer-science-resume-example.txt
32,"data visualization, mathematics, mysql, sql",,6.25,b.s.,0,output\resume\entry-level-data-scientist-resume-example.txt
33,"aws, databases, git, hadoop, mathematics, mysql, nltk, pandas, python",,0,,0,output\resume\experienced-data-scientist-resume-example.txt
34,"apache kafka, gcp, machine learning, postgresql, tensorflow",,0,,0,output\resume\google-data-scientist-resume-example.txt
35,"aws, hadoop, machine learning, mysql, nltk, python, tensorflow",,0,,0,output\resume\healthcare-data-scientist-resume-example.txt
36,"aws, c++",communication,0,,0,output\resume\masters-in-computer-science-resume-example.txt
37,"aws, hadoop, html5, machine learning, pandas, python, sql","decision making, integrity",3.667,b.s.,0,output\resume\metadata-scientist-resume-example.txt
38,"aws, azure, flask, git, keras, mysql, nlp, pandas, python, sql",,12.25,phd,0,output\resume\nlp-data-scientist-resume-example.txt
39,"aws, hadoop, machine learning, mysql, pandas, python, pytorch",,0,,0,output\resume\python-data-scientist-resume-example.txt
40,"python, unity",,0,b.tech,0,output\resume\resume.txt
41,"aws, big data, c++, cloud computing, deep learning, devops, docker, feature engineering, git, integration testing, machine learning, mathematics, nlp, pandas, python, pytorch, scrum, sql","collaboration, communication, leadership",0,phd,0,output\resume\resume7.txt
42,"aws, big data, data visualization, git, hadoop, machine learning, mysql, opencv, python, sql, sqlite, tensorflow",communication,0,m.s.,0,output\resume\resume_juanjosecarin.txt
43,"c++, computer vision, deep learning, machine learning, python, pytorch, sql",collaboration,8.083,b.s.,0,output\resume\senior-computer-vision-scientist-resume-example.txt
44,"elasticsearch, flask, mathematics, mysql, pandas, python, sql",integrity,11.667,master's,0,output\resume\senior-data-scientist-resume-example.txt
45,"Kibana, Pygame, OWASP Top 10, IntelliJ IDEA, nlp, Blockchain, TensorFlow, Metasploit, SQLite, JavaScript","Multitasking, Patience, Self-Awareness",4.23,Master's,0,generate_resume0.txt
46,"Integration Testing, Bash Scripting, Solidity, Linux, Prometheus, Unity, Grafana, MongoDB, nlp","Active Listening, Presentation Skills, Stress Management, Organization, Growth Mindset",4.07,M.Tech,0,generate_resume1.txt
47,Smart Contracts,"Persuasion, Accountability, Work Ethic",7.04,Bachelor's,0,generate_resume2.txt
48,"Pandas, trasformers, Machine Learning, JavaScript, Playwright, Hadoop, databases, Redis, Deep Learning","Constructive Feedback, Public Speaking",5.55,PhD,0,generate_resume3.txt
49,"Penetration Testing, Gradio, Cloud Computing, Redis, BERT, Unity, Grafana, Bash Scripting, tdd, gcp","Emotional Intelligence, Organization, Cultural Awareness, Dependability",9.04,MBA,0,generate_resume4.txt
50,"JavaScript, Functional Programming, Bash Scripting, Ansible, Apache Spark, CSS3, Time Series Analysis","Negotiation, Learning Agility, Flexibility, Self-Motivation, Interpersonal Skills",6.67,B.S.,0,generate_resume5.txt
51,Pandas,"Leadership, Positive Attitude",2.29,B.E.,0,generate_resume6.txt
52,"SQLite, Machine Learning, Pygame, Keras, Azure, Flask, Time Series Analysis, DevOps, Model Deployment","Conflict Resolution, Attention to Detail",6.36,M.S.,0,generate_resume7.txt
53,"MongoDB, Cloud Computing, OWASP Top 10, Hadoop, Burp Suite, Google Colab, OpenCV",Presentation Skills,9.4,B.Tech,0,generate_resume8.txt
54,"TensorFlow, Solidity, Networking, SQLite, CI/CD Pipelines",Emotional Intelligence,3.49,B.E.,0,generate_resume9.txt
55,"Google Colab, DevOps, Agile Methodologies, React, MLOps, Bash Scripting, Deep Learning, MySQL","Learning Agility, Leadership",5.07,PhD,0,generate_resume10.txt
56,"REST APIs, Time Series Analysis, HTML5, Solidity, BERT, Statistical Analysis, Jupyter Notebooks, databases, PostgreSQL, MySQL","Initiative, Learning Agility, Emotional Intelligence, Resilience, Cultural Awareness",5.99,B.Sc,0,generate_resume11.txt
57,"Bash Scripting, trasformers, oop, Kubernetes, Logstash, Streamlit, PostgreSQL, Scrum, LangChain, T5","Multitasking, Giving Feedback",2.87,MBA,0,generate_resume12.txt
58,"Terraform, Machine Learning","Listening to Feedback, Problem-Solving, Time Management, Adaptability to Change",4.21,M.S.,0,generate_resume13.txt
59,"GraphQL, Streamlit","Negotiation, Self-Awareness, Cultural Awareness",6.65,PhD,0,generate_resume14.txt
60,"Smart Contracts, RabbitMQ, IntelliJ IDEA, Java, HTML5, Agile Methodologies, Metasploit, Apache Kafka",Responsibility,2.87,PhD,0,generate_resume15.txt
61,"Selenium, Data Wrangling, Google Colab, Smart Contracts, Coding Interview Preparation, Metasploit, Java, IntelliJ IDEA","Positive Attitude, Accountability",4.47,Bachelor's,0,generate_resume16.txt
62,"Ethical Hacking, Pygame",Problem-Solving,9.09,B.S.,0,generate_resume17.txt
63,"Big Data, NLTK","Adaptability, Problem-Solving, Cultural Awareness, Active Listening, Team Building",7.73,M.S.,0,generate_resume18.txt
64,"Gradio, SQLite, Software Testing, oop, Unit Testing, Cybersecurity, Scrum","Teamwork, Accountability",6.04,MBA,0,generate_resume19.txt
65,"tdd, JavaScript",Public Speaking,9.04,Bachelor's,0,generate_resume20.txt
66,Terraform,"Work Ethic, Emotional Intelligence",2.07,B.Tech,0,generate_resume21.txt
67,"Integration Testing, Ethereum, Apache Kafka, DevOps, Git, Jupyter Notebooks","Accountability, Collaboration, Self-Motivation, Time Management",8.06,B.Tech,0,generate_resume22.txt
68,"Data Engineering, Jupyter Notebooks, databases, Kubernetes, C++, Scikit-learn, SQLite, Keras","Empathy, Accountability, Attention to Detail, Collaboration, Teamwork",4.74,B.E.,0,generate_resume23.txt
69,"Grafana, Java, OpenCV, Apache Spark, Penetration Testing, Solidity, NLTK, PyTorch","Networking, Positive Attitude, Negotiation, Work Ethic",3.53,MBA,0,generate_resume24.txt
70,Reinforcement Learning,"Networking, Critical Thinking, Respectfulness, Goal Setting, Collaboration",8.48,PhD,0,generate_resume25.txt
71,"Jupyter Notebooks, MongoDB, OWASP Top 10, Java, JavaScript, RabbitMQ, Integration Testing, Terraform","Confidence, Initiative, Collaboration",6.29,B.Sc,0,generate_resume26.txt
72,Time Series Analysis,"Leadership, Time Management, Confidence, Accountability, Work Ethic",4.95,Master's,0,generate_resume27.txt
73,"GraphQL, Ansible, Flask, GPT models, PyTorch","Professionalism, Stress Management, Listening to Feedback",6.07,Bachelor's,0,generate_resume28.txt
74,MongoDB,"Patience, Public Speaking, Self-Motivation, Creativity",5.96,M.S.,0,generate_resume29.txt
75,"Keras, Penetration Testing, IntelliJ IDEA","Team Building, Collaboration, Open-Mindedness, Work Ethic, Self-Motivation",7.51,M.Tech,0,generate_resume30.txt
76,"Agile Methodologies, Selenium, Penetration Testing, Pygame, PostgreSQL, Git","Positive Attitude, Emotional Intelligence, Constructive Feedback, Self-Motivation",3.76,Master's,0,generate_resume31.txt
77,"Unity, Data Wrangling, GraphQL","Work Ethic, Conflict Resolution, Flexibility",3.15,M.Tech,0,generate_resume32.txt
78,"MongoDB, Terraform, PyTorch, Scrum, BERT, Data Visualization, Redis",Patience,6.87,PhD,0,generate_resume33.txt
79,"GraphQL, oop","Work Ethic, Accountability",3.36,Bachelor's,0,generate_resume34.txt
80,"TensorFlow, React, Scikit-learn, C++, Ansible, Networking","Emotional Intelligence, Listening to Feedback, Communication, Adaptability to Change, Goal Setting",6.55,Master's,0,generate_resume35.txt
81,"Azure, Terraform, REST APIs, Integration Testing, Pandas, Metasploit, SQL, Streamlit",Accountability,5.92,Bachelor's,0,generate_resume36.txt
82,"CI/CD Pipelines, Django, Feature Engineering","Resourcefulness, Initiative, Self-Awareness, Presentation Skills, Attention to Detail",9.38,M.S.,0,generate_resume37.txt
83,"T5, Jupyter Notebooks, Prometheus, React, Big Data, Integration Testing","Teamwork, Confidence, Giving Feedback, Open-Mindedness, Emotional Intelligence",6.79,B.Tech,0,generate_resume38.txt
84,"Machine Learning, Web3.js, Networking, Django, SQL, Apache Spark, OpenCV",Leadership,5.09,B.Tech,0,generate_resume39.txt
85,"Terraform, Algorithms & Data Structures, Mathematics, Solidity, Deep Learning, React, Statistical Analysis, Linux","Problem-Solving, Open-Mindedness, Public Speaking, Constructive Feedback",7.76,Bachelor's,0,generate_resume40.txt
86,"REST APIs, Algorithms & Data Structures, NLTK, SQL","Confidence, Empathy, Initiative",5.52,PhD,0,generate_resume41.txt
87,"Grafana, Playwright, IntelliJ IDEA, Gradio, Computer Vision, Feature Engineering","Growth Mindset, Team Building, Patience, Time Management",2.94,PhD,0,generate_resume42.txt
88,"Google Colab, Data Visualization, Networking, LangChain, Kibana, Ansible, Apache Spark, Scrum, Smart Contracts",Integrity,8.05,Bachelor's,0,generate_resume43.txt
89,"Integration Testing, tdd, Elasticsearch, BERT, Data Engineering, Algorithms & Data Structures, Docker, Linux","Conflict Resolution, Adaptability to Change, Giving Feedback, Persuasion",4.7,M.S.,0,generate_resume44.txt
90,"Metasploit, Google Colab, CSS3, Algorithms & Data Structures, Logstash, Solidity, Networking, MongoDB, Feature Engineering","Interpersonal Skills, Resilience, Active Listening, Creativity",2.91,Bachelor's,0,generate_resume45.txt
91,"BERT, Time Series Analysis, Playwright, HTML5, Python, Hadoop","Critical Thinking, Listening to Feedback, Empathy",4.8,Master's,0,generate_resume46.txt
92,"Blockchain, LangChain, gcp","Adaptability to Change, Persuasion",4.58,M.Tech,0,generate_resume47.txt
93,"Pandas, MongoDB, T5, Gradio, Smart Contracts, Java","Public Speaking, Active Listening",5.78,PhD,0,generate_resume48.txt
94,"databases, Bash Scripting","Initiative, Resourcefulness, Critical Thinking",6.78,B.S.,0,generate_resume49.txt
95,"Functional Programming, trasformers, Metasploit, MLOps, Kubernetes, CI/CD Pipelines, Feature Engineering, Machine Learning, Linux","Open-Mindedness, Conflict Resolution, Interpersonal Skills, Creativity",8.51,B.S.,0,generate_resume50.txt
96,"GPT models, Time Series Analysis, Java, Burp Suite, Computer Vision, Ethical Hacking, SQL, trasformers, databases","Self-Awareness, Problem-Solving, Decision Making, Teamwork",6.13,PhD,0,generate_resume51.txt
97,Time Series Analysis,"Networking, Attention to Detail, Decision Making, Self-Awareness, Respectfulness",4.22,B.Tech,0,generate_resume52.txt
98,"Ethereum, C++, LangChain, Git, Burp Suite, Scrum",Cultural Awareness,3.16,M.Tech,0,generate_resume53.txt
99,"Ethical Hacking, Functional Programming, Django, Integration Testing, VS Code, DevOps, MLOps, SQL, React, Deep Learning","Respectfulness, Interpersonal Skills",5.58,M.S.,0,generate_resume54.txt
100,"Keras, GPT models, MySQL",Accountability,6.58,PhD,0,generate_resume55.txt
101,"Scrum, Metasploit, MLOps, Data Visualization, Logstash, GraphQL, xai, Kibana, Machine Learning","Giving Feedback, Resourcefulness, Dependability, Public Speaking",9.34,MBA,0,generate_resume56.txt
102,"MySQL, Selenium, LangChain, Software Testing, Scikit-learn",Growth Mindset,2.65,Master's,0,generate_resume57.txt
103,Scrum,Communication,3.85,B.Tech,0,generate_resume58.txt
104,"MongoDB, Django, PyTorch, REST APIs, Git","Initiative, Interpersonal Skills, Decision Making, Communication",8.33,B.Tech,0,generate_resume59.txt
105,"Data Wrangling, GPT models, CI/CD Pipelines, T5, Gradio","Emotional Intelligence, Flexibility",9.81,M.Tech,0,generate_resume60.txt
106,"Flask, JavaScript, CI/CD Pipelines","Leadership, Flexibility, Respectfulness, Active Listening, Teamwork",3.96,B.Sc,0,generate_resume61.txt
107,"Prometheus, Java, SQL, RabbitMQ, Apache Spark, OWASP Top 10, gcp, Selenium, Apache Kafka","Communication, Adaptability, Listening to Feedback, Adaptability to Change",6.13,Bachelor's,0,generate_resume62.txt
108,"gcp, CSS3, Grafana","Learning Agility, Stress Management",6.78,B.Tech,0,generate_resume63.txt
109,"Web3.js, C++, Bash Scripting, VS Code, Scikit-learn, OpenCV, Ethereum","Giving Feedback, Resilience, Constructive Feedback",9.23,MBA,0,generate_resume64.txt
110,"xai, Linux, Logstash, Data Wrangling","Active Listening, Critical Thinking, Flexibility",8.15,B.S.,0,generate_resume65.txt
111,"Deep Learning, Redis, Unit Testing, BERT, SQL, Kubernetes, databases","Dependability, Open-Mindedness",10.0,Master's,0,generate_resume66.txt
112,"VS Code, OWASP Top 10, Azure, Blockchain, Functional Programming, Solidity, Software Testing","Interpersonal Skills, Active Listening, Respectfulness, Negotiation",3.66,B.Tech,0,generate_resume67.txt
113,"Java, MySQL, AWS, Docker, SQL","Emotional Intelligence, Patience, Adaptability to Change, Constructive Feedback",9.88,M.Tech,0,generate_resume68.txt
114,"Django, Data Visualization, Python, Burp Suite, Agile Methodologies, VS Code","Critical Thinking, Empathy",2.95,B.E.,0,generate_resume69.txt
115,"Terraform, Java, Grafana, SQLite, C++","Accountability, Public Speaking",2.99,Bachelor's,0,generate_resume70.txt
116,"Keras, Java, Streamlit, NLTK",Learning Agility,4.84,B.Tech,0,generate_resume71.txt
117,"Scikit-learn, gcp, Redis, GPT models, C++, DevOps, Prometheus","Leadership, Creativity",7.79,PhD,0,generate_resume72.txt
118,VS Code,Presentation Skills,9.19,Bachelor's,0,generate_resume73.txt
119,"PyTorch, BERT, Networking, Docker, Kubernetes, Prometheus","Organization, Integrity, Confidence, Accountability, Adaptability",3.11,MBA,0,generate_resume74.txt
120,"Networking, MongoDB, REST APIs, Logstash, Hadoop, PostgreSQL, Playwright, Coding Interview Preparation","Adaptability, Constructive Feedback",9.84,MBA,0,generate_resume75.txt
121,"Statistical Analysis, Pygame, Cloud Computing, AWS, Ethereum, Jupyter Notebooks, Kibana, Hadoop, trasformers","Presentation Skills, Growth Mindset, Active Listening, Dependability, Organization",7.11,PhD,0,generate_resume76.txt
122,"Flask, JavaScript","Flexibility, Confidence, Professionalism, Responsibility, Growth Mindset",4.96,M.Tech,0,generate_resume77.txt
123,"Terraform, Scikit-learn","Networking, Team Building, Listening to Feedback, Creativity, Public Speaking",4.81,B.Tech,0,generate_resume78.txt
124,"Integration Testing, Apache Spark, OWASP Top 10, Smart Contracts, Model Deployment, Agile Methodologies","Growth Mindset, Adaptability",6.08,B.E.,0,generate_resume79.txt
125,"Solidity, AWS, Unit Testing, nlp",Leadership,2.36,B.E.,0,generate_resume80.txt
126,Algorithms & Data Structures,"Empathy, Multitasking",4.43,B.Tech,0,generate_resume81.txt
127,Cybersecurity,"Work Ethic, Integrity, Respectfulness, Decision Making",8.36,Master's,0,generate_resume82.txt
128,"Cybersecurity, gcp, Grafana","Leadership, Self-Awareness, Problem-Solving",3.37,MBA,0,generate_resume83.txt
129,"Statistical Analysis, Web3.js, Playwright, Keras",Resilience,5.52,B.Tech,0,generate_resume84.txt
130,Smart Contracts,"Empathy, Giving Feedback",8.59,PhD,0,generate_resume85.txt
131,"React, Computer Vision","Constructive Feedback, Dependability, Self-Awareness",3.52,B.E.,0,generate_resume86.txt
132,"LangChain, GraphQL, MLOps, Hadoop, C++, GPT models, OWASP Top 10, CI/CD Pipelines, BERT","Goal Setting, Empathy",7.02,Master's,0,generate_resume87.txt
133,"Scikit-learn, RabbitMQ, PyTorch, Cybersecurity, Unity","Time Management, Critical Thinking, Collaboration",7.2,Master's,0,generate_resume88.txt
134,"MongoDB, Time Series Analysis, Ethical Hacking, Scrum, Cybersecurity, React",Leadership,2.06,M.Tech,0,generate_resume89.txt
135,"Integration Testing, Prometheus, Software Testing, OWASP Top 10, Metasploit, Data Wrangling, Streamlit, Statistical Analysis, CI/CD Pipelines",Teamwork,3.68,B.S.,0,generate_resume90.txt
136,"Feature Engineering, React, Ansible, Elasticsearch, Unit Testing, xai, Networking","Critical Thinking, Work Ethic",4.39,PhD,0,generate_resume91.txt
137,"Bash Scripting, REST APIs, Blockchain","Problem-Solving, Responsibility, Creativity",4.86,B.E.,0,generate_resume92.txt
138,"Agile Methodologies, Flask, Scrum","Growth Mindset, Flexibility, Negotiation",2.11,MBA,0,generate_resume93.txt
139,"Mathematics, Flask, Deep Learning, Algorithms & Data Structures, MongoDB, Apache Spark, Feature Engineering, Data Engineering","Growth Mindset, Public Speaking, Work Ethic, Adaptability, Active Listening",7.14,PhD,0,generate_resume94.txt
140,"tdd, Java, OWASP Top 10, databases, Elasticsearch, Jupyter Notebooks","Organization, Constructive Feedback, Resilience",8.61,M.Tech,0,generate_resume95.txt
141,"Unity, PostgreSQL, Solidity, Django, Jupyter Notebooks, Deep Learning, Azure, Git, Blockchain","Time Management, Respectfulness, Decision Making",2.73,B.Sc,0,generate_resume96.txt
142,"Functional Programming, NLTK, TensorFlow","Decision Making, Self-Awareness, Accountability, Constructive Feedback",3.68,Bachelor's,0,generate_resume97.txt
143,"Google Colab, databases, SQL, DevOps, HTML5, BERT, Scrum, Ethereum","Creativity, Accountability",6.31,B.Sc,0,generate_resume98.txt
144,"Grafana, Data Wrangling, Agile Methodologies, Solidity, RabbitMQ, Redis, tdd","Persuasion, Multitasking, Leadership, Networking, Work Ethic",2.85,PhD,0,generate_resume99.txt
145,"Python, SQLite, Streamlit, GPT models, VS Code, Git, Prometheus, Linux, T5","Conflict Resolution, Constructive Feedback",5.14,MBA,0,generate_resume100.txt
146,"Cybersecurity, tdd, Agile Methodologies, T5, Pygame, SQL, Apache Kafka, Bash Scripting",Conflict Resolution,5.41,B.E.,0,generate_resume101.txt
147,"Keras, CSS3, Smart Contracts, T5, NLTK, OWASP Top 10","Teamwork, Decision Making, Critical Thinking, Cultural Awareness, Positive Attitude",4.16,Master's,0,generate_resume102.txt
148,"Python, Unity, Docker, Networking, Bash Scripting, trasformers, BERT","Learning Agility, Patience, Critical Thinking, Open-Mindedness, Collaboration",5.35,M.S.,0,generate_resume103.txt
149,Penetration Testing,"Learning Agility, Collaboration, Communication, Creativity, Adaptability",2.41,Master's,0,generate_resume104.txt
150,"LangChain, oop, nlp, Penetration Testing",Resourcefulness,5.42,B.S.,0,generate_resume105.txt
151,"OpenCV, Blockchain, Computer Vision, HTML5, Elasticsearch, Flask","Active Listening, Resourcefulness, Flexibility, Work Ethic, Networking",9.99,Master's,0,generate_resume106.txt
152,"RabbitMQ, VS Code, TensorFlow",Multitasking,3.95,M.Tech,0,generate_resume107.txt
153,"Flask, Selenium, Kibana","Time Management, Conflict Resolution, Patience, Flexibility, Self-Awareness",8.92,M.S.,0,generate_resume108.txt
154,"Keras, BERT, Cybersecurity, Java, Model Deployment",Stress Management,6.94,Bachelor's,0,generate_resume109.txt
155,"PostgreSQL, GraphQL, Docker, GPT models, CSS3, React, Unity, BERT, Redis","Resourcefulness, Interpersonal Skills",4.93,M.S.,0,generate_resume110.txt
156,"BERT, Mathematics, Big Data, NLTK, Django, CSS3, Linux",Positive Attitude,7.15,Master's,0,generate_resume111.txt
157,"Scrum, Smart Contracts, Networking, Bash Scripting, Data Wrangling, CI/CD Pipelines, Functional Programming, Penetration Testing, Ethical Hacking, Hadoop","Adaptability, Creativity, Adaptability to Change, Resilience, Open-Mindedness",4.63,M.Tech,0,generate_resume112.txt
158,"Agile Methodologies, Unit Testing, Metasploit, CI/CD Pipelines, Algorithms & Data Structures","Listening to Feedback, Adaptability, Confidence, Time Management",4.96,M.Tech,0,generate_resume113.txt
159,"Streamlit, Kibana, Grafana","Cultural Awareness, Resourcefulness",10.0,B.E.,0,generate_resume114.txt
160,"Java, Algorithms & Data Structures, VS Code, RabbitMQ, Azure, Bash Scripting, LangChain, nlp, Elasticsearch, MySQL","Patience, Self-Motivation, Resourcefulness",9.15,MBA,0,generate_resume115.txt
161,"Hadoop, RabbitMQ, Scikit-learn, Smart Contracts, Java, Prometheus, Elasticsearch, Networking, Blockchain","Resourcefulness, Growth Mindset",3.66,Master's,0,generate_resume116.txt
162,"Machine Learning, Solidity, nlp, Blockchain, Mathematics","Goal Setting, Flexibility, Professionalism",4.83,PhD,0,generate_resume117.txt
163,"Git, CSS3, Redis, React, IntelliJ IDEA, RabbitMQ, Ansible","Networking, Decision Making, Accountability, Professionalism, Collaboration",6.87,B.S.,0,generate_resume118.txt
164,"Hadoop, Streamlit, Apache Kafka, Pandas, Ansible, Computer Vision, CSS3, IntelliJ IDEA, MySQL, Java","Constructive Feedback, Teamwork, Persuasion, Resilience",3.6,M.S.,0,generate_resume119.txt
165,"JavaScript, trasformers, Ethical Hacking, Machine Learning, Terraform","Attention to Detail, Resilience, Open-Mindedness, Giving Feedback",6.18,Bachelor's,0,generate_resume120.txt
166,"MLOps, Unit Testing, Algorithms & Data Structures, Ethereum","Resilience, Listening to Feedback, Public Speaking, Problem-Solving, Self-Motivation",4.68,M.S.,0,generate_resume121.txt
167,"SQL, Functional Programming, Django, Scikit-learn, MongoDB, Smart Contracts, Networking, Solidity, Ansible","Active Listening, Stress Management, Confidence, Empathy",7.92,B.Sc,0,generate_resume122.txt
168,"Apache Spark, Computer Vision, Data Engineering","Self-Motivation, Confidence, Flexibility, Leadership, Critical Thinking",2.49,M.Tech,0,generate_resume123.txt
169,"Java, Burp Suite, Gradio, Docker","Stress Management, Patience",2.21,PhD,0,generate_resume124.txt
170,"Deep Learning, trasformers, Integration Testing","Leadership, Constructive Feedback, Networking, Conflict Resolution, Collaboration",2.6,B.S.,0,generate_resume125.txt
171,"Git, Grafana, Machine Learning, Coding Interview Preparation, trasformers, Solidity, PyTorch, Networking, GPT models","Decision Making, Communication, Teamwork",7.36,M.Tech,0,generate_resume126.txt
172,"Google Colab, Linux, Pandas, Big Data, Networking, Ethical Hacking, Data Visualization, Streamlit, Keras","Persuasion, Creativity",9.81,B.Tech,0,generate_resume127.txt
173,Big Data,"Listening to Feedback, Decision Making, Team Building, Attention to Detail, Initiative",4.56,Master's,0,generate_resume128.txt
